{
  "$schema": "https://json-schema.org/draft/2020-12/schema",
  "$id": "https://openvaluesstandard.org/schema/register-evidence-review-v1.schema.json",
  "title": "Open Values Register Evidence Review",
  "description": "The record of a person checking the sample of entries in one evidence bundle against the register and the option mappings, and approving or rejecting it. Reviewers write it by hand, and only an approved receipt whose bundle has not changed lets the evidence into the catalogue.",
  "type": "object",
  "required": ["format", "version", "registerId", "snapshotId", "evidence", "evidenceSha256", "status", "reviewedBy", "reviewedOn", "samples"],
  "additionalProperties": false,
  "properties": {
    "format": { "description": "Names the file format. Always open-values-register-evidence-review.", "const": "open-values-register-evidence-review" },
    "version": { "description": "The version of this format the file follows. Always 1.0.0.", "const": "1.0.0" },
    "registerId": { "description": "The id of the register the reviewed evidence comes from.", "type": "string", "pattern": "^[a-z0-9]+(?:-[a-z0-9]+)*$" },
    "snapshotId": { "description": "The id of the snapshot the reviewed evidence was built from.", "type": "string", "pattern": "^\\d{4}-\\d{2}-\\d{2}-[0-9a-f]{12}$" },
    "evidence": { "description": "Path of the evidence bundle this receipt reviews, under pipeline/registers/evidence/. Each bundle has at most one receipt.", "type": "string", "pattern": "^pipeline/registers/evidence/[^/]+\\.evidence\\.json$" },
    "evidenceSha256": { "description": "The SHA-256 hash of the bundle file as reviewed. If the bundle changes, the hash no longer matches and the receipt stops counting.", "type": "string", "pattern": "^[0-9a-f]{64}$" },
    "status": { "description": "approved means the sample checked out and the bundle may be promoted into lenses. rejected means it did not.", "enum": ["approved", "rejected"] },
    "reviewedBy": { "description": "Who did the review: a person's name or the name of the review pass.", "type": "string", "minLength": 1 },
    "reviewedOn": { "description": "The date of the review, as YYYY-MM-DD.", "type": "string", "format": "date" },
    "samples": {
      "description": "One row per entry in the bundle's review sample. The entry ids must be exactly the ones the bundle names in reviewRequirement.",
      "type": "array",
      "maxItems": 10,
      "uniqueItems": true,
      "items": {
        "type": "object",
        "required": ["entryId", "mappingChecked", "sourceChecked", "note"],
        "additionalProperties": false,
        "properties": {
          "entryId": { "description": "The entry checked, written as cid/entityCode.", "type": "string", "minLength": 1 },
          "mappingChecked": { "description": "Always true: the reviewer confirmed the option is the legal entity it was mapped to.", "const": true },
          "sourceChecked": { "description": "Always true: the reviewer confirmed the facts against the public register.", "const": true },
          "note": { "description": "What the reviewer compared and found, in a sentence.", "type": "string", "minLength": 1 }
        }
      }
    }
  }
}
