{
  "format": "open-values-register-evidence-review",
  "version": "1.0.0",
  "registerId": "france-durability",
  "snapshotId": "2026-08-14-3d8a07c29d1f",
  "evidence": "pipeline/registers/evidence/france-durability-2026-08-14-3d8a07c29d1f.evidence.json",
  "evidenceSha256": "0a02cdc77388cfa39334dd6a1630b71d126365029c4b64da20523318136de110",
  "status": "approved",
  "reviewedBy": "Phase 8 source review",
  "reviewedOn": "2026-08-14",
  "samples": [
    {
      "entryId": "washing-machines/hotpoint-hb93-care",
      "mappingChecked": true,
      "sourceChecked": true,
      "note": "Unique record id, row 734, GTIN, regional model suffix, producer, calculation date, overall score, and both component scores agree with the consolidated CSV."
    },
    {
      "entryId": "washing-machines/samsung-ww80t4020ehef",
      "mappingChecked": true,
      "sourceChecked": true,
      "note": "Unique record id, row 1493, exact model, producer, calculation date, overall score, and both component scores agree. The filing itself labels the non-numeric model identifier as GTIN_EAN, which the generated note preserves rather than correcting."
    },
    {
      "entryId": "washing-machines/whirlpool-w0m310wads",
      "mappingChecked": true,
      "sourceChecked": true,
      "note": "Unique record id, row 671, GTIN, regional model suffix, producer, calculation date, overall score, and both component scores agree with the consolidated CSV."
    }
  ]
}
